{
  "schema_version": "2.0.0",
  "dataset_version": "2.0.0",
  "source_digest": "sha256:9ba72aaf5858c29f6bb29deada732f1bd613791c18fb2280ff66b0b311e2ee2e",
  "locale": "ko",
  "questions": [
    {
      "case_id": "action-incident-mitigation-draft.audit_oriented",
      "expectation_id": "action-incident-mitigation-draft",
      "runtime_context": "incident_binding",
      "variation_kind": "audit_oriented",
      "question": "감사에 남길 수 있도록 답해 주세요. 현재 대화에 연결된 장애의 검증된 증상, 영향, 근거 공백을 사용해 검토 전용 완화 제안을 작성해 주세요."
    },
    {
      "case_id": "action-incident-mitigation-draft.concise",
      "expectation_id": "action-incident-mitigation-draft",
      "runtime_context": "incident_binding",
      "variation_kind": "concise",
      "question": "빠르게 확인하고 싶어요. 현재 대화에 연결된 장애의 검증된 증상, 영향, 근거 공백을 사용해 검토 전용 완화 제안을 작성해 주세요."
    },
    {
      "case_id": "action-incident-mitigation-draft.contrastive",
      "expectation_id": "action-incident-mitigation-draft",
      "runtime_context": "incident_binding",
      "variation_kind": "contrastive",
      "question": "현재 대화에 연결된 장애의 검증된 증상, 영향, 근거 공백을 사용해 검토 전용 완화 제안을 작성해 주세요. 관측 사실과 근거 없는 추정을 구분해 주세요."
    },
    {
      "case_id": "action-incident-mitigation-draft.direct",
      "expectation_id": "action-incident-mitigation-draft",
      "runtime_context": "incident_binding",
      "variation_kind": "direct",
      "question": "현재 대화에 연결된 장애의 검증된 증상, 영향, 근거 공백을 사용해 검토 전용 완화 제안을 작성해 주세요."
    },
    {
      "case_id": "action-incident-mitigation-draft.evidence_first",
      "expectation_id": "action-incident-mitigation-draft",
      "runtime_context": "incident_binding",
      "variation_kind": "evidence_first",
      "question": "검증된 근거만 사용해 주세요. 현재 대화에 연결된 장애의 검증된 증상, 영향, 근거 공백을 사용해 검토 전용 완화 제안을 작성해 주세요."
    },
    {
      "case_id": "action-incident-mitigation-draft.investigative",
      "expectation_id": "action-incident-mitigation-draft",
      "runtime_context": "incident_binding",
      "variation_kind": "investigative",
      "question": "작업 관점에서 조사해 주세요. 현재 대화에 연결된 장애의 검증된 증상, 영향, 근거 공백을 사용해 검토 전용 완화 제안을 작성해 주세요."
    },
    {
      "case_id": "action-incident-mitigation-draft.operator_colloquial",
      "expectation_id": "action-incident-mitigation-draft",
      "runtime_context": "incident_binding",
      "variation_kind": "operator_colloquial",
      "question": "지금 운영자가 확인해야 해요. 현재 대화에 연결된 장애의 검증된 증상, 영향, 근거 공백을 사용해 검토 전용 완화 제안을 작성해 주세요."
    },
    {
      "case_id": "action-incident-mitigation-draft.uncertainty_aware",
      "expectation_id": "action-incident-mitigation-draft",
      "runtime_context": "incident_binding",
      "variation_kind": "uncertainty_aware",
      "question": "현재 대화에 연결된 장애의 검증된 증상, 영향, 근거 공백을 사용해 검토 전용 완화 제안을 작성해 주세요. 확인된 사실과 알 수 없는 부분을 나눠 주세요."
    },
    {
      "case_id": "action-recovery-draft.audit_oriented",
      "expectation_id": "action-recovery-draft",
      "runtime_context": "explicit_target_required",
      "variation_kind": "audit_oriented",
      "question": "감사에 남길 수 있도록 답해 주세요. 필수 안전장치와 검증 공백을 모두 보존해 PostgreSQL Flexible Server 복구 제안을 작성해 주세요."
    },
    {
      "case_id": "action-recovery-draft.concise",
      "expectation_id": "action-recovery-draft",
      "runtime_context": "explicit_target_required",
      "variation_kind": "concise",
      "question": "빠르게 확인하고 싶어요. 필수 안전장치와 검증 공백을 모두 보존해 PostgreSQL Flexible Server 복구 제안을 작성해 주세요."
    },
    {
      "case_id": "action-recovery-draft.contrastive",
      "expectation_id": "action-recovery-draft",
      "runtime_context": "explicit_target_required",
      "variation_kind": "contrastive",
      "question": "필수 안전장치와 검증 공백을 모두 보존해 PostgreSQL Flexible Server 복구 제안을 작성해 주세요. 관측 사실과 근거 없는 추정을 구분해 주세요."
    },
    {
      "case_id": "action-recovery-draft.direct",
      "expectation_id": "action-recovery-draft",
      "runtime_context": "explicit_target_required",
      "variation_kind": "direct",
      "question": "필수 안전장치와 검증 공백을 모두 보존해 PostgreSQL Flexible Server 복구 제안을 작성해 주세요."
    },
    {
      "case_id": "action-recovery-draft.evidence_first",
      "expectation_id": "action-recovery-draft",
      "runtime_context": "explicit_target_required",
      "variation_kind": "evidence_first",
      "question": "검증된 근거만 사용해 주세요. 필수 안전장치와 검증 공백을 모두 보존해 PostgreSQL Flexible Server 복구 제안을 작성해 주세요."
    },
    {
      "case_id": "action-recovery-draft.investigative",
      "expectation_id": "action-recovery-draft",
      "runtime_context": "explicit_target_required",
      "variation_kind": "investigative",
      "question": "작업 관점에서 조사해 주세요. 필수 안전장치와 검증 공백을 모두 보존해 PostgreSQL Flexible Server 복구 제안을 작성해 주세요."
    },
    {
      "case_id": "action-recovery-draft.operator_colloquial",
      "expectation_id": "action-recovery-draft",
      "runtime_context": "explicit_target_required",
      "variation_kind": "operator_colloquial",
      "question": "지금 운영자가 확인해야 해요. 필수 안전장치와 검증 공백을 모두 보존해 PostgreSQL Flexible Server 복구 제안을 작성해 주세요."
    },
    {
      "case_id": "action-recovery-draft.uncertainty_aware",
      "expectation_id": "action-recovery-draft",
      "runtime_context": "explicit_target_required",
      "variation_kind": "uncertainty_aware",
      "question": "필수 안전장치와 검증 공백을 모두 보존해 PostgreSQL Flexible Server 복구 제안을 작성해 주세요. 확인된 사실과 알 수 없는 부분을 나눠 주세요."
    },
    {
      "case_id": "action-rollback-draft.audit_oriented",
      "expectation_id": "action-rollback-draft",
      "runtime_context": "explicit_target_required",
      "variation_kind": "audit_oriented",
      "question": "감사에 남길 수 있도록 답해 주세요. Container Apps 리비전 변경에 연결된 복구 계획만 사용해 롤백 제안을 작성하되 실행하지 마세요."
    },
    {
      "case_id": "action-rollback-draft.concise",
      "expectation_id": "action-rollback-draft",
      "runtime_context": "explicit_target_required",
      "variation_kind": "concise",
      "question": "빠르게 확인하고 싶어요. Container Apps 리비전 변경에 연결된 복구 계획만 사용해 롤백 제안을 작성하되 실행하지 마세요."
    },
    {
      "case_id": "action-rollback-draft.contrastive",
      "expectation_id": "action-rollback-draft",
      "runtime_context": "explicit_target_required",
      "variation_kind": "contrastive",
      "question": "Container Apps 리비전 변경에 연결된 복구 계획만 사용해 롤백 제안을 작성하되 실행하지 마세요. 관측 사실과 근거 없는 추정을 구분해 주세요."
    },
    {
      "case_id": "action-rollback-draft.direct",
      "expectation_id": "action-rollback-draft",
      "runtime_context": "explicit_target_required",
      "variation_kind": "direct",
      "question": "Container Apps 리비전 변경에 연결된 복구 계획만 사용해 롤백 제안을 작성하되 실행하지 마세요."
    },
    {
      "case_id": "action-rollback-draft.evidence_first",
      "expectation_id": "action-rollback-draft",
      "runtime_context": "explicit_target_required",
      "variation_kind": "evidence_first",
      "question": "검증된 근거만 사용해 주세요. Container Apps 리비전 변경에 연결된 복구 계획만 사용해 롤백 제안을 작성하되 실행하지 마세요."
    },
    {
      "case_id": "action-rollback-draft.investigative",
      "expectation_id": "action-rollback-draft",
      "runtime_context": "explicit_target_required",
      "variation_kind": "investigative",
      "question": "작업 관점에서 조사해 주세요. Container Apps 리비전 변경에 연결된 복구 계획만 사용해 롤백 제안을 작성하되 실행하지 마세요."
    },
    {
      "case_id": "action-rollback-draft.operator_colloquial",
      "expectation_id": "action-rollback-draft",
      "runtime_context": "explicit_target_required",
      "variation_kind": "operator_colloquial",
      "question": "지금 운영자가 확인해야 해요. Container Apps 리비전 변경에 연결된 복구 계획만 사용해 롤백 제안을 작성하되 실행하지 마세요."
    },
    {
      "case_id": "action-rollback-draft.uncertainty_aware",
      "expectation_id": "action-rollback-draft",
      "runtime_context": "explicit_target_required",
      "variation_kind": "uncertainty_aware",
      "question": "Container Apps 리비전 변경에 연결된 복구 계획만 사용해 롤백 제안을 작성하되 실행하지 마세요. 확인된 사실과 알 수 없는 부분을 나눠 주세요."
    },
    {
      "case_id": "action-rule-remediation-draft.audit_oriented",
      "expectation_id": "action-rule-remediation-draft",
      "runtime_context": "none",
      "variation_kind": "audit_oriented",
      "question": "감사에 남길 수 있도록 답해 주세요. 현재 위반이나 대상 리소스를 주장하지 말고 remediate.restrict-network-access를 선언한 활성 Rule에서 검토 전용 수정 제안을 작성해 주세요."
    },
    {
      "case_id": "action-rule-remediation-draft.concise",
      "expectation_id": "action-rule-remediation-draft",
      "runtime_context": "none",
      "variation_kind": "concise",
      "question": "빠르게 확인하고 싶어요. 현재 위반이나 대상 리소스를 주장하지 말고 remediate.restrict-network-access를 선언한 활성 Rule에서 검토 전용 수정 제안을 작성해 주세요."
    },
    {
      "case_id": "action-rule-remediation-draft.contrastive",
      "expectation_id": "action-rule-remediation-draft",
      "runtime_context": "none",
      "variation_kind": "contrastive",
      "question": "현재 위반이나 대상 리소스를 주장하지 말고 remediate.restrict-network-access를 선언한 활성 Rule에서 검토 전용 수정 제안을 작성해 주세요. 관측 사실과 근거 없는 추정을 구분해 주세요."
    },
    {
      "case_id": "action-rule-remediation-draft.direct",
      "expectation_id": "action-rule-remediation-draft",
      "runtime_context": "none",
      "variation_kind": "direct",
      "question": "현재 위반이나 대상 리소스를 주장하지 말고 remediate.restrict-network-access를 선언한 활성 Rule에서 검토 전용 수정 제안을 작성해 주세요."
    },
    {
      "case_id": "action-rule-remediation-draft.evidence_first",
      "expectation_id": "action-rule-remediation-draft",
      "runtime_context": "none",
      "variation_kind": "evidence_first",
      "question": "검증된 근거만 사용해 주세요. 현재 위반이나 대상 리소스를 주장하지 말고 remediate.restrict-network-access를 선언한 활성 Rule에서 검토 전용 수정 제안을 작성해 주세요."
    },
    {
      "case_id": "action-rule-remediation-draft.investigative",
      "expectation_id": "action-rule-remediation-draft",
      "runtime_context": "none",
      "variation_kind": "investigative",
      "question": "작업 관점에서 조사해 주세요. 현재 위반이나 대상 리소스를 주장하지 말고 remediate.restrict-network-access를 선언한 활성 Rule에서 검토 전용 수정 제안을 작성해 주세요."
    },
    {
      "case_id": "action-rule-remediation-draft.operator_colloquial",
      "expectation_id": "action-rule-remediation-draft",
      "runtime_context": "none",
      "variation_kind": "operator_colloquial",